{
  "type": "summary",
  "content": "Testing My workflow 3 - the active workflow",
  "source": "active-workflow-test",
  "metadata": {
    "version": 1,
    "hash": "3114917a"
  },
  "timestamp": "2025-09-19T11:58:17.720Z",
  "file": {
    "filename": "3114917a.json",
    "mimetype": "application/json"
  },
  "fileName": "C:\\Users\\saurabh\\VertexAutoGPT\\data\\summary\\3114917a.json"
}