{
  "type": "summary",
  "content": "test",
  "source": "test",
  "metadata": {
    "version": 1,
    "hash": "96a8565e"
  },
  "timestamp": "2025-09-19T11:19:26.034Z",
  "file": {
    "filename": "96a8565e.json",
    "mimetype": "application/json"
  },
  "fileName": "C:\\Users\\saurabh\\VertexAutoGPT\\data\\summary\\96a8565e.json"
}