{
  "type": "summary",
  "content": "Testing from terminal command - this is working!",
  "source": "terminal_test",
  "metadata": {
    "version": 1,
    "hash": "d8cf52e8"
  },
  "timestamp": "2025-09-19T10:52:39.380Z",
  "file": {
    "filename": "d8cf52e8.json",
    "mimetype": "application/json"
  },
  "fileName": "C:\\Users\\saurabh\\VertexAutoGPT\\data\\summary\\d8cf52e8.json"
}