{
  "type": "summary",
  "content": "Testing CMD approach",
  "source": "cmd-test",
  "metadata": {
    "version": 1,
    "hash": "9321cd5b"
  },
  "timestamp": "2025-09-19T11:53:06.721Z",
  "file": {
    "filename": "9321cd5b.json",
    "mimetype": "application/json"
  },
  "fileName": "C:\\Users\\saurabh\\VertexAutoGPT\\data\\summary\\9321cd5b.json"
}