{
  "type": "summary",
  "content": "Final verification test",
  "source": "final-verify",
  "metadata": {
    "version": 1,
    "hash": "2bace783"
  },
  "timestamp": "2025-09-19T12:30:13.046Z",
  "file": {
    "filename": "2bace783.json",
    "mimetype": "application/json"
  },
  "fileName": "C:\\Users\\saurabh\\VertexAutoGPT\\data\\summary\\2bace783.json"
}