{
  "type": "summary",
  "content": "This is a test message for data processing validation",
  "source": "manual_test",
  "metadata": {
    "version": 1,
    "hash": "bb75fdac"
  },
  "timestamp": "2025-09-19T10:43:21.143Z",
  "file": {
    "filename": "bb75fdac.json",
    "mimetype": "application/json"
  },
  "fileName": "C:\\Users\\saurabh\\VertexAutoGPT\\data\\summary\\bb75fdac.json"
}