{
  "type": "summary",
  "content": "Test data from enhanced CLI",
  "source": "cli_enhanced_test",
  "metadata": {
    "version": 1,
    "hash": "d62ad9df"
  },
  "timestamp": "2025-09-19T09:36:22.066Z",
  "file": {
    "filename": "d62ad9df.json",
    "mimetype": "application/json"
  },
  "fileName": "C:\\Users\\saurabh\\VertexAutoGPT\\data\\summary\\d62ad9df.json"
}