{
  "type": "summary",
  "content": "Test webhook data from n8n",
  "source": "n8n_webhook",
  "metadata": {
    "version": 1,
    "hash": "1aaa7f03"
  },
  "timestamp": "2025-09-19T10:44:53.499Z",
  "file": {
    "filename": "1aaa7f03.json",
    "mimetype": "application/json"
  },
  "fileName": "C:\\Users\\saurabh\\VertexAutoGPT\\data\\summary\\1aaa7f03.json"
}